{
  "schemaVersion": 1,
  "contractVersion": "1.0.0",
  "messageType": "BRAKE_HEALTH_ASSESSMENT",
  "assessmentId": "a8ff857c-a7ca-5a59-a3fc-4e4ae90ffe3a",
  "sourceEventId": "4cba2d80-c04a-4d24-9f03-f4a85d56da13",
  "unitSystemUid": "demo-unit-validation-001",
  "unitRole": "VALIDATION",
  "serviceVersion": "2.0.0",
  "serviceArtifactSha256": "3333333333333333333333333333333333333333333333333333333333333333",
  "vdpContractVersion": "2.0.0",
  "vdpContractSha256": "2222222222222222222222222222222222222222222222222222222222222222",
  "modelId": "brake-condition-demo-v1",
  "modelVersion": "1.0.0",
  "modelArtifactSha256": "3333333333333333333333333333333333333333333333333333333333333333",
  "modelConfigSha256": "ea74cda63116d1f9fc969ec292aedb7cd0935ae899775bd8bcd73c230190e028",
  "provenance": "DEMO_SYNTHETIC",
  "assessedAt": "2026-08-22T12:00:08.000Z",
  "content": {
    "sourceWindowStartTimestamp": "2026-08-22T12:00:00.000Z",
    "sourceWindowEndTimestamp": "2026-08-22T12:00:07.900Z",
    "activeSampleCount": 30,
    "straightActiveSampleCount": 30,
    "features": {
      "peakDecelerationMps2": 6.4,
      "peakDecelerationBps": 8000,
      "activeDurationSeconds": 3,
      "activeDurationBps": 6000,
      "speedReductionKph": 32,
      "speedReductionBps": 8000,
      "meanBrakeEffortPercent": 75,
      "meanBrakeEffortBps": 5000,
      "wheelDispersionRatio": 0.09,
      "wheelDispersionBps": 6000
    },
    "episodeLoadBps": 6750,
    "wearIndexBefore": 54,
    "wearIncrement": 8,
    "wearIndexAfter": 62,
    "conditionScore": 38,
    "previousBand": "MONITOR",
    "currentBand": "INSPECTION_RECOMMENDED",
    "quality": "VALID_DEMO_SYNTHETIC"
  },
  "contentSha256": "b1b5858b114898519fa0f4fe600864727df3c9f28c8228b182661ab6f183b932"
}
